{"aggregate_sha256":"3751017afddce5e8cde97e7cca7ea06451b214b172e58db73a41629f0497802e","algorithm":"sha256-protocol-bundle-manifest-v1","entrypoint":"SKILL.md","files":[{"mode":"0644","path":"AGENTS.md","sha256":"8b4afe6ee4394a383f44cbba591be866ccb9764f9216e3fef52dd1e9d6fcf95c","size":7817},{"mode":"0644","path":"README.md","sha256":"bad9c91db3f0a113bf5ead69e0681642c1c127ba078065f0dd4ac5711583c5f0","size":27751},{"mode":"0644","path":"SKILL.md","sha256":"8cbf3c07d1e7e2d6cf4a532d7a80af2252ebf296333cf75bb5af446f52109945","size":64584},{"mode":"0644","path":"examples/example_child_loop_tree/INDEX.yaml","sha256":"ee032132dbe859f3fbcbe3206901431261578886f7bf30a1c1a8ffbbc6ba4d46","size":286},{"mode":"0644","path":"examples/example_child_loop_tree/L001-example-delivery/_loops/INDEX.yaml","sha256":"cc215254a9a44e2e4c9ffd2991e6c2abbb4f9f47a4cd2d18c8633b2caf2bb1e3","size":174},{"mode":"0644","path":"examples/example_child_loop_tree/L001-example-delivery/_loops/L001.01-fix-effectiveness-bug/checkpoint.yaml","sha256":"31b44c75674c7098ababfde06e40d645d621fb344bb55b73eb8013616379e086","size":1706},{"mode":"0644","path":"examples/example_child_loop_tree/L001-example-delivery/_loops/L001.01-fix-effectiveness-bug/closeout.md","sha256":"c81b1ff06075a9d6e11ee066d6122ef2369909cc0fb859457e5d313fc47fb260","size":1636},{"mode":"0644","path":"examples/example_child_loop_tree/L001-example-delivery/_loops/L001.01-fix-effectiveness-bug/event_log.jsonl","sha256":"a056299e55f8e8e60d05698b50f6fcca89a62728bb937129bbbd16e9a9b5819d","size":503},{"mode":"0644","path":"examples/example_child_loop_tree/L001-example-delivery/_loops/L001.01-fix-effectiveness-bug/evidence.ledger.yaml","sha256":"1e4f4893ae2170170090a95aad5ec147e837e2658ee7cfde55a5248e5d030ba6","size":429},{"mode":"0644","path":"examples/example_child_loop_tree/L001-example-delivery/_loops/L001.01-fix-effectiveness-bug/evidence/reproduce.txt","sha256":"789741297220b60f139e2d8cd56d03bd5223fc56c35881560397af7f86fcdd6f","size":176},{"mode":"0644","path":"examples/example_child_loop_tree/L001-example-delivery/_loops/L001.01-fix-effectiveness-bug/loop.meta.yaml","sha256":"d3f6fac378bebd7449207e81b069bc8af9d2f68bce582a2abadd74883856392b","size":1692},{"mode":"0644","path":"examples/example_child_loop_tree/L001-example-delivery/_loops/L001.01-fix-effectiveness-bug/loop.plan.yaml","sha256":"220f248c59490b541c0bef21e3b785a9a0e55ade775cc8f71355cdf81018b75a","size":4156},{"mode":"0644","path":"examples/example_child_loop_tree/L001-example-delivery/checkpoint.yaml","sha256":"6a603e47bc542f597c629dbb6676f6c461de615ca30ac249e604e989677de8a8","size":1200},{"mode":"0644","path":"examples/example_child_loop_tree/L001-example-delivery/closeout.md","sha256":"b14dd7a21c36c37a6f09c53d4b285594cc7111dbe788721b2fd2099301e1cbce","size":1475},{"mode":"0644","path":"examples/example_child_loop_tree/L001-example-delivery/event_log.jsonl","sha256":"b78ee431f54c8bb5cde7962e4e60c588e30df85c9efb23b2e4995875b3abfceb","size":486},{"mode":"0644","path":"examples/example_child_loop_tree/L001-example-delivery/evidence.ledger.yaml","sha256":"4b0a487a81aaf83810343e667fd60bbab9224e50d2ab3521441c96717fe104c9","size":477},{"mode":"0644","path":"examples/example_child_loop_tree/L001-example-delivery/evidence/charter.md","sha256":"042a66c775b18e88989b3be5f79f1b804c7d40f092013d6b96a1840f9ed795f4","size":209},{"mode":"0644","path":"examples/example_child_loop_tree/L001-example-delivery/loop.meta.yaml","sha256":"c23bec07b22b80445ff84d9debb90eafe30dead21e606f6be469523d32198631","size":911},{"mode":"0644","path":"examples/example_child_loop_tree/L001-example-delivery/loop.plan.yaml","sha256":"a8aef838c379fd9904c054daf8d6bb093563ff8555406b298aed55934ff7a3b1","size":4558},{"mode":"0644","path":"examples/example_child_loop_tree/README.md","sha256":"c5167057313f703f87602a14662036662f5990fbe822738619b11a8b5303781e","size":4756},{"mode":"0644","path":"examples/example_product_delivery/README.md","sha256":"bc49d40ba163a7262ca6b0f559095873382a4797d4cdb80996282e9a559537c5","size":8219},{"mode":"0644","path":"examples/example_product_delivery/checkpoint.yaml","sha256":"b7d9ae0e66e5929a5ab53ce76466ebeab3d29a773afe69bc3672e772c3b6df5d","size":3652},{"mode":"0644","path":"examples/example_product_delivery/event_log.jsonl","sha256":"ac2c943ec438e0511475d4b6dc037b4b6b3fd1d4ec488b96d080acf60ed30fa1","size":4645},{"mode":"0644","path":"examples/example_product_delivery/evidence.ledger.yaml","sha256":"0b4437112ba64ba430022c05bc8eae90e0f62f7089cc4b2825b8f4b274a35781","size":9035},{"mode":"0644","path":"examples/example_product_delivery/evidence/N0_charter.md","sha256":"e119cdfc0dfc9962ba2d5d298ab2c4cd6b8e028bb90e04dbfe92d0b9c2f11b95","size":201},{"mode":"0644","path":"examples/example_product_delivery/evidence/N1_discovery.md","sha256":"5ceba3e20af765bca0439e4b1e63bbc8e9e2a745196e439cb2163f064469fa06","size":185},{"mode":"0644","path":"examples/example_product_delivery/evidence/N2_risk_screen.md","sha256":"f33e4720fa0d905960766bbcda156cf8e8c25c535947922b486d951d6b969420","size":200},{"mode":"0644","path":"examples/example_product_delivery/evidence/N3_feasibility.txt","sha256":"e71556deca15c981dc0ae752c7fc213fa721ee3abe3637f054cda99a544e2b31","size":185},{"mode":"0644","path":"examples/example_product_delivery/evidence/N4_requirements_baseline.md","sha256":"fc30e228537239baae2a50dff3b478682d06e3d978119d13f8c9a7838b0d9366","size":194},{"mode":"0644","path":"examples/example_product_delivery/evidence/N5_architecture.md","sha256":"ed3dba55c9f7a50ceec0171777ce54e13e71c56a2404fe95b6943f90c57921e3","size":194},{"mode":"0644","path":"examples/example_product_delivery/evidence/N6_verification_plan.txt","sha256":"f0199bb20fbe228d10774d81338a6ffcbc28f1664dc12a5f318b543d54252d89","size":150},{"mode":"0644","path":"examples/example_product_delivery/evidence/N7_implementation.txt","sha256":"e4cb1ac29eae9d2226a456f48687cb7194f4768feecd2b02707b265e50f5b57f","size":133},{"mode":"0644","path":"examples/example_product_delivery/evidence/N8_review.md","sha256":"d823ef45b4389bdcc2e146dbe3b5a1dc169c073f90e5876cef9302606c1149f7","size":189},{"mode":"0644","path":"examples/example_product_delivery/loop.plan.yaml","sha256":"f3267ecc233d01ae7edd5cac461110218d17c80ccc101512808df07eab7a0a98","size":19531},{"mode":"0644","path":"examples/example_research_project/README.md","sha256":"239ab60ad17a2a3a63268269756538e6cf7dce676bd3511e7e11ae977ec2cf46","size":7975},{"mode":"0644","path":"examples/example_research_project/artifacts/protocol/preregistration.md","sha256":"f114e788ab5a6dcb588a121a0afc95931fa76eaac800a684b0d2cbaf0f626d75","size":293},{"mode":"0644","path":"examples/example_research_project/checkpoint.yaml","sha256":"94eb22dae3b3838774e15c7ecb23d0e8ac99e3b0f07e589c6ac66e629dc8227c","size":3706},{"mode":"0644","path":"examples/example_research_project/event_log.jsonl","sha256":"3096bb9a1a37264cd6c5dc831ddce6295c000f684fb5b8b94ff22e0f58378488","size":3200},{"mode":"0644","path":"examples/example_research_project/evidence.ledger.yaml","sha256":"ab8c56d44016f50297bb73bb277e6e2ac5cc5c6c434f38c9f8236342c16b91b4","size":7179},{"mode":"0644","path":"examples/example_research_project/evidence/N0_charter.md","sha256":"0a7fe9179248003f9a4d1e3cd098b8993744d3941ff4f74e9accf5d0618e18dd","size":209},{"mode":"0644","path":"examples/example_research_project/evidence/N1_scoping.md","sha256":"d899d71dbaa89e864a97b62646edc0a51465d78a31878901b09deae217411c13","size":214},{"mode":"0644","path":"examples/example_research_project/evidence/N2_source_gathering.md","sha256":"50eb3d3054deda948cc667a37ea67b0f183df870ebc267551a9c97b478d9a024","size":229},{"mode":"0644","path":"examples/example_research_project/evidence/N3_evidence_appraisal.md","sha256":"9ba86ce554074762ea59e7c89218f2c0dbcf673223f0c9d52914119ba1dbb924","size":236},{"mode":"0644","path":"examples/example_research_project/evidence/N4_hypothesis_framing.md","sha256":"2a5c2ee29ac29a327ddf1c1b81a271535b4e9f8e6df8c598310bd9f605afcf9a","size":187},{"mode":"0644","path":"examples/example_research_project/loop.plan.yaml","sha256":"fb7cd8d4b889b2bebd4ba35347443068385e9ca7977aa61c74f9c4ac2e3c6258","size":19162},{"mode":"0644","path":"examples/example_v2_lightweight/goal.json","sha256":"31bd32091d7cbdafaf9f468d262405970ce82b9a257158d434e6acd80690e6d8","size":683},{"mode":"0644","path":"examples/example_v2_lightweight/plans/plan-v1.json","sha256":"499ab63a926ee1af9ecfbc92d44ea68540cf0912f9fc476e3995d3092cecdcfa","size":1436},{"mode":"0644","path":"examples/example_v2_persistent/goal.json","sha256":"13acebf30f6a014adc7371310190bcb2ba351076cd1ed643c3e56e5efe6a5f09","size":957},{"mode":"0644","path":"examples/example_v2_persistent/journal.jsonl","sha256":"c7dd681b600b57b559518f638eb607da76a539af44b6eeaeb022fe63b64e9fe8","size":3096},{"mode":"0644","path":"examples/example_v2_persistent/plans/plan-v1.json","sha256":"b752a2df33e35a241bb420facd5922d9785e0056dd4a9338564ebf8a5e0af09b","size":1453},{"mode":"0644","path":"examples/example_v2_persistent/resume.json","sha256":"1642a5f50ac32fe1b9bd53672fffbb3cd2818a2c41a551db75beffde3c4da3c3","size":1215},{"mode":"0644","path":"references/branching_parallelism.md","sha256":"03e0f2c436fe2af153101d779592abf34fc0c72e57be84ba8efdb8cd92d632ca","size":23641},{"mode":"0644","path":"references/command_system.md","sha256":"d276d85c1004525b9d97d292d627a6aa606ebe41a5d5ad6600af82468948620f","size":5418},{"mode":"0644","path":"references/concepts.md","sha256":"f2e1813301cda6e02b99c5aaae2b83d2e37ce53ef4590be641323121b8daf480","size":19726},{"mode":"0644","path":"references/evidence_gates.md","sha256":"1367e117c2e6a8dfbcfa61ce93af9bea89574eb6067f5e229e612863191e91a2","size":24262},{"mode":"0644","path":"references/exception_handling.md","sha256":"30fdae72353e33492896a14d527516658bf8b0d7925361e4e1ebccafa8095250","size":34551},{"mode":"0644","path":"references/execution_intelligence_policy.md","sha256":"4767736a9a8b7fba6d6ac28d9f0f7262334d6d1893bd12a3a8e97a1ba97780d9","size":37999},{"mode":"0644","path":"references/human_appro